operatingSys,subcategory,description,what_is_new,url,NumInstall,DatePublished,softwareVersion,size,topDeveloper,reviews_num,Num_star,app_name
      4.0.3 and up    ,Adventure,"Undersea complex called Emerald Maiden hides a lot of dark mysteries. On the surface it appears to be a paradise, when in fact it’s not what it seems to be. Reveal the secret hidden in dreams and save your loved ones!,TRY IT FREE, THEN UNLOCK THE FULL ADVENTURE FROM WITHIN THE GAME!,Try the remastered edition of the wonderful, classic adventure game!,In the process of enhancing the game:,• we added more languages,• boosted the graphics,• improved the gameplay,• optimized the game for mobile,London 1957. You have been abandoned on an orphanage doorstep as a child. Now – 25 years later – you receive an envelope with an invitation on a mystery voyage and an old picture of you and your mother together. ,Why did your mom leave you and how is she connected to the secret organization? To discover the truth, you embark on a trip to the Emerald Maiden. Soon it becomes apparent that something very wrong is going on inside this supposed “playground for the rich and elite”.,Relying on your wits alone, you will have to face the facilities darkest secrets, learn the truth about your family and flee before it’s too late!,Are you strong enough to challenge the ancient evil lurking deep under the sea in The Emerald Maiden?,• Thrilling story in a unique underwater setting!,• 19 challenging minigames to test your wits!,• 25 original hidden object scenes to explore!,• A personal robot will help you on your quest!,• High-end, immersive gameplay, optimized for tablets and phones!, +++ WE ARE HERE +++,WWW: ,http://artifexmundi.com,FACEBOOK: ,http://facebook.com/artifexmundi,TWITTER: ,http://twitter.com/ArtifexMundi,YOUTUBE: ,http://youtube.com/user/ArtifexMundi,PINTEREST: ,http://pinterest.com/artifexmundi,+++ MORE ARTIFEX MUNDI GAMES ! +++,Vampire Legends: The True Story of Kisilova,The Secret Order 2: Masked Intent,The Dreamatorium: of Dr. Magnus 2,Dark Heritage: Guardians of Hope,Queens Quest: Tower of Darkness,Grim Legends: The Forsaken Bride,Fairy Tale Mysteries: The Puppet Thief,Demon Hunter: Chronicles from Beyond,Time Mysteries: Inheritance,Clockwork Tales: Of Glass and Ink,Deadly Puzzles: Toymaker",,,"  10,000 - 50,000  ",17-Feb-16,,,Top Developer,989,4.4,The Emerald Maiden
      4.0 and up    ,Creativity,"Play with little Sophia in her fashion boutique style room, tailor your dream dress and shoes, and design cute jewelry!,Little Sophia loves kids crafts and she wants to teach all girls how to make a dress, a pair of summer shoes, a bracelet and a ring. Get ready for tons of girls fun in Sophia's Fashion House - play kids tailor or dress up and makeover Sophia like a little princess!,**Game Features**,MAKE A DRESS: Follow Sophia's sewing tips, tailor a girly pink dress and decorate it with your favorite accessories. Take a picture of your creation and share it with your friends!,TAILOR SHOES: Prepare for summer season, make a pair of cute sandals and decorate them with diamonds and butterflies!,MAKE A BRACELET: Free you imagination and design the most beautiful bracelet from colorful gems!,MAKE A RING: Try out jewelry designer tools and make a fancy gold ring with sparkly diamonds for Sophia. Decorate her hand with matching bracelet and accessories!,DRESS UP: Play Sophia's stylist and dress her with girly dresses, cute shoes, colorful bracelets, rings and earrings!,STICKER BOOK: Play Sophia's Fashion House tailor games for girls every day and collect 8 stickers!,WATCH VIDEO: Watch cute kids videos and earn 200 extra coins!,- - -,Discover more fun with TutoTOONS!,Play our games: ,http://tutotoons.com/games,Follow us on Twitter: ,https://twitter.com/TutoTOONSGames,Like us on Facebook: ,https://www.facebook.com/tutotoonsgames,Follow us on Instagram: ,https://instagram.com/tutotoons/,Meet us on Google+: ,https://plus.google.com/+Tutotoonsgames,Follow us on Pinterest: ,https://www.pinterest.com/tutotoons/,Get our newsletter: ,http://ow.ly/HlYbn",,,"  100,000 - 500,000  ",4-Mar-16, 1.0.4  , 29M  ,,477,3.5,Sophia's Fashion House
      4.1 and up    ,Role Playing,"All I remember is that night... The dark dragon has closed the gate to the sun. And light vanished. All living creatures became dark... Only carrying what's left behind... the eternal pain.,In the darkness that has lost light… True dark action begins.,▪ Side scrolling hack and slash RPG,▪ Stylish dark fantasy graphics,▪ System for farming and strengthening different weapons,▪ Over 100 stages and monsters,▪ Hardcore mode for the fearless,You must overcome the eternal darkness and defeat the Dark Dragon.,May the light shine upon you!",,,"  10,000 - 50,000  ",12-Mar-16, 1.0.71  , 47M  ,,"1,227",4.4,Dark Sword
      3.2 and up    ,Education,"Teaching little kindergarten and preschool children about ABC, counting, colours, animals and shapes is easy with our fun and intuitive preschool games.,With lots of beautiful drawings, colorful animals and characters, accompanied by sounds and music, with an easy as 1, 2, 3, menus and buttons, you'll find this game quite easily to interact with, and simple to navigate to the activities you want your children to play.,Starting from the bottom of the map, kids are invited to learn how to draw letters, with voice-overs for each letter, animals to associate with and simple to follow instructions, preschoolers will find this educational game a fun activity to play while learning how to write all the letters of the alphabet!,Numbers are also really simple and fun for kids to draw, at the second stage of the game, where they can follow the instructions and write each number in the correct manner.,After playing around with numbers and letters, kids can go in learning the basics of math. With wonderful illustrations of animals like zebras, dogs, butterflies, and colorful numbers, kids will find these kind of educative games very attractive and fun to play, easy as dragging the number associated with the animals in the right spot, they can learn how to do addition and subtraction in a very cool way!,Surely these are some very engaging educational activities, but there is also a level in the app where kids can relax by playing some puzzles with Shape and objects. Some color matching games, where kids can learn some new colours and names, maybe a fun card memory game and many other simple games of matching, dragging or finding numbers and letters.,Are they feeling very confident of what you have learned so far, well anytime you want to check what you're kids have managed to learn, they can play the exam level, where they will have to complete all kinds of fun challenges, like matching the parts of the body with the corresponding names, helping animals get to their home, or playing a fun labyrinth game and also many other letter puzzles, drawing challenges and also math exercises.,Here are some of the features that this app covers:, - Drawing numbers, shapes, letters and other animals or objects, - Spelling numbers and letters, - Math games, addition and subtraction, - Puzzles, - Matching, - Colors, - Patterns, - Spot the difference, ,As you will find out preschool learning covers most of the important categories that are suitable and engaging for any kindergarten or preschool children out there. Have fun!",,,"  5,000 - 10,000  ",4-Mar-16, 1.0.0  , 45M  ,,56,4,Preschool Learning
      2.3 and up    ,Casual,"Mandala coloring book gives you more than 200 unique mandala coloring pages with fun detailed designs that you can color using paintbox ., ,Mandala coloring book for adults (and also children) ! Print and color right now and have fun., ,You can choose from our gallery of Mandala coloring book and start coloring and paint with a paintbox.,Mandala coloring book is not an activity dedicated only for children, on the contrary, adults can also have fun with mandala coloring pages., ,This activity is recognized for these relaxing virtues and is practiced for centuries, especially with mandalas and intricate designs., ,All you have to do is choose one page from our library and start coloring. If you preffer you can save them to your device or by email, SMS or whatsapp, Facebook., ,Discover now our Mandala coloring Book for adults. Our pages are filled with fun detailed designs that will keep you busy and relaxed for hours!, ,Mandalas to color promotes relaxation, attention, concentration, better management of stress, development of psychomotor skills…, ,# App Features, ,★ Simply tap to pick color and paint, all you need is your imagination!,★ Mandala coloring book for adults and also children,★ Personalized color palettes, pick your favorite one or create your own palette !,★ Mandala coloring pages is a meditations app,★ Be able to save different version of your artwork for the same sketch and revisit later!,★ Reduce anxiety and stress by using Mandala coloring book!,★ Lots of beautiful illustrations and drawings to color, and more are coming!,★ Share with others ( Facebook, Whatsapp , Twitter, Email ...) or save to your Photos!,★ Easy to save your work and share them with all your friends, whenever and however you like it!,★ Long press to pick current color, , ,# How to use Mandala meditations ?, ,• Select a Mandala categorie for coloring.,• Select a Mandala template for coloring.,• Use the color palette you like.,• Color the Mandala to your by tapping on each gap of the drawing.,• You can share, store, create a copy etc.",,,"  1,000 - 5,000  ",14-Feb-16,1, 27M  ,,60,4.7,Mandala Coloring Book
      2.2 and up    ,Casual,"We have been working on the Toy Robot War series for a really long time. ,We developed many bots with vivid color and models. We like to introduce you the Violent T-Rex, namely the Violent Robot Tyrannosaurus Rex. Let's enjoy the awesome experience of assembling this giant dragon! In this version, we added treasure chest. After every victory you will have a chance to open a treasure chest. When you have enough diamond you could unlock the ultimate skill!!! In challenge mode you can be the domination of the city. Destroy the building, with kick-ass skill you will be invincible. In fight mode, you will meet multiple bosses and would use your skill to defeat the boss. ,Enjoy the awesome fighting experience!,Key Feature:,- Get the pieces out of the box!,- Giant dragon robot to assemble!,- Be the domination of the city with the Tyrannosaurus Rex.,- Defeat the boss with your kick-ass skill.,What’s New:,-New game mode added. Once you defeat a boss you will have a chance to open the treasure chest.,-You can get diamond from treasure chest,-The Ultimate diamond will help you unlock the ultimate skill!!!!, , We hope you would love this game, and if you have any suggestion or question please follow us on:,Facebook: ,https://www.facebook.com/acoolstudio1,Twitter:@acoolstdio,youtube:,https://www.youtube.com/channel/UCloJTCjRuIHzGGG8MOlk8vw,tumblr: ,http://acoolstudio.tumblr.com/,If you like to say something, you can also reach us by this email address: ,acoolstudio@gmail.com",,,"  1,000 - 5,000  ",2-Mar-16, 1.0.0  , 33M  ,,52,4.1,Toy Robot War:Violent T-Rex
      2.3 and up    ,Puzzle,"Escape Games Day-233 is a point and click escape game developed by JoyArrows.,It has contains scenes of Forest and Forest Home.,In that game have to Escape with Wild Treasure.,In this Game contains some hidden objects and simple puzzles.,You have to find the objects where it is hidden and have to solve the puzzles to Escape with Wild Treasure.,Are you to ready to play the game.Use your smart skills.,All the best.Have more fun.",,,"  1,000 - 5,000  ",5-Mar-16, v1.0.0  , 2.3M  ,,92,4.7,Escape Games Day-233
      2.3 and up    ,Adventure,"Kids Games for the little ones replenished remarkable novelty. Baby Hippo and her family arrived at the airport to go on an exciting journey. Our favorite characters are waiting for an adventure, but first they need to drop off your luggage to check. In the meantime, the family fun is waiting for his flight, baby Hippo decided to find out how the airport operates. Good Uncle Dog allowed her to sort baggage with him.,Try to put on a conveyor belt right amount of bags. Do the same thing, but choosing the right color of the bags. And so the journey was safe and nothing will spoil our adventures enlighten suitcases on a special device. Try to recognize objects, packed in bags and suitcases. Sort bags so fun and exciting!,Besides, our kids games help children develop. Your child easily and playfully learn to count and recognize the color of an object. Baby Hippo will help him and embolden at failure. To send Hippo family on a journey, you need to accurately sort their bags and choose the right items, packed in them. Our kids games harmoniously teach your child and will give him a good mood.,And now that the sort is nothing more to be seated on a plane and leave the airport. Embark on a long-awaited trip, where you are waiting for new fun adventure. But this is only the beginning of a series of games about the airport! The kids games with your child, you can play forever! That is why we will continue to delight you and your children's novelties. Our free educational games for boys and girls set with love for you. Stay with us, stay tuned and dive into fun adventures that you will give baby Hippo.",,,"  10,000 - 50,000  ",9-Mar-16,1.3, 26M  ,,80,3.4,Kids Airport Adventure
      2.3 and up    ,Puzzle,"Get into the holiday spirit and celebrate Saint Patrick's Day!,""Saint Patrick's Day"" is a jigsaw-like game brimming with stunning HD artworks. Solve 20 beautiful, hand crafted puzzles as difficulty increases. Can you become the hidden piece master?,Main features:,- Unique puzzle game mechanic,- 20 hand-crafted backgrounds,- Beat your best times,- Daily rewards,- Replay for high scores,- Become the hidden piece master!,Powered by Dolby® on supported devices",,,"  500 - 1,000  ",6-Mar-16, 1.0.0  , 23M  ,,31,4.9,Hidden Pieces St Patrick's Day
      2.3 and up    ,Casino,"Video Poker - Deluxe Casino -- The newest video poker game is coming!!,AMAZING FEATURES:,*** PLENTY OF THEMES ***,Classic Jacks or Better, Deuces Wild, Multi-Plus Bonus, and we are adding more amazing themes into the game every week! ,*** GLOBAL LEADERBOARD & HALL-OF-FAME! ***,Everybody have chance to win the championship and chips prize EVERYDAY! Do you have the best video poker strategy? Come on and beat others!,*** AMAZING PAYOUTS & BADGES! ***,Hit Royal Straight Flush and collect the badge! Show other players your great playing with your fantastic profile page!,*** PLENTY OF FREE CHIPS! ***,Collect free chips every 10 minutes and never running out of chips! Enjoy the game and have fun!,COME ON AND JOIN US NOW! WELCOME!!!",,,"  50,000 - 100,000  ",9-Mar-16,1.1, 28M  ,,61,2.8,Video Poker - Deluxe Casino
      4.0 and up    ,Casual,"A travel holiday to Paris with your BFF means it’s time for some fashion!  Get into the mood for the finer things in life on your amazing holiday by treating yourself to some amazing me time!  ,Spa, makeup and dress up await you!  Paris is amazing, and you want to look and feel your best, so it’s time for a little pampering.  Your BFF and you need to spend a little time on yourselves, so hit the hotel spa.  There are some awe-inspiring facial treatments that will get your skin smooth and soft.  Top off your glowing look with a little expertly applied makeup.  Finish your Paris holiday look with trying on some amazing fashion outfits.,How to Play:,• Visiting Paris with your BFF is awesome,• A travel holiday can be fun, but exhausting,• Relax with amazing spa treatments,• Glam up with some sweet makeup,• Get fashionable with some fun dress up,• Time to get your sightseeing on!,Paris and fashion go hand in hand.  Get ready to roam the streets looking for all your must-see travel destinations on your list by a little spa time.  You’ll look great for all your pictures to share with your friends back home.  Download now!",,,"  5,000 - 10,000  ",18-Feb-16,1, 43M  ,,159,4.2,Fashion Paris - Makeover Salon
      2.2 and up    ,Casual,"The #1 FREE fashion game returns with Fashion Story: SPRING STEAMPUNK!,Fashion-hungry customers are lined up waiting for the doors of your hot new boutique to swing open! Choose and stock the latest fashions and designs, layout your shop with changing rooms and decorations, and prepare for chic Steampunk get-togethers!,- PERSONALIZE and accessorize your own character! Choose makeup, hairstyles, and hot clothes!,- TRENDSET by unlocking designer clothes lines and flashy accessories that customers will love!,- DESIGN your dream boutique! Showcase your style and creativity with wallpaper, decorations, and art!,- COLLECT the wardrobe of your dreams! Stock your closet and create gorgeous outfits!,- SOCIALIZE with sister boutiques, and collect bonuses from other fashionistas!,- FREE to download, FREE to play, FREE weekly updates with new clothing and decorations!,Please note that Fashion Story Spring Steampunk is free to play, but you can purchase in-app items with real money. To disable this feature, go to the Google Play app on your device, tap the Menu button, select Settings > Use password to restrict purchases. Then follow the directions to complete setup. In addition, Fashion Story Spring Steampunk may link to social media services, such as Facebook, and Storm8 will have access to your information through such services.,Storm8 Studios is the #1 Mobile Social Game Developer on Android.,Use of this application is governed by the Storm8 Studios Terms of Service. Collection and use of data are subject to Storm8 Studios Privacy Policy. Both policies are available at ,http://www.storm8-studios.com/terms/, and ,http://www.storm8-studios.com/privacy/",,,"  500 - 1,000  ",1-Mar-16, 1.5.6.7  , 19M  ,Top Developer,32,4.3,Fashion Story Spring Steampunk
      2.3.3 and up    ,Racing,"Fast Traffic Racing 2016 is challenges and interesting game.,Experience high speed driving without any limits! Racing Car 3D is the next-gen endless driving game for mobiles!,Fast Traffic Racing 2016 is an addictive game for the fans of arcade racing and driving simulations.,HIGH SPEED DRIVING,Race at high speeds, drive against traffic and overtake cars Buses on road!,HIGH QUALITY GRAPHICS,Enjoy the cutting edge 3D graphics with realistically created environments and amazingly detailed cars.,EXPLORE DIFFERENT THEMES,Take a ride in Desert, City,Seaport,Beach, or have a snowy one in Winter. ,Each environment are realisticly created and highly detailed.,GAME MODES FOR EVERY MOOD,Feel the Fever in One Way and Two Way, rush a quick game in Time Attack or drive calmly in Free Ride.,DRIVE IT YOUR WAY,Control your car as you like.,MULTIPLE CAMERA ANGLES,Each camera angle offers a unique driving experience.,THE CAR OF YOUR DREAMS,Upgrade your car,Make it better, faster, stronger and prettier.,SLOW MOTION MODE,Don't push your luck in sticky situations, slow time for easier manoeuvres. ,It does not last forever but quickly refills.,LANGUAGE SUPPORT,Available in all countries languages suported.,KEY FEATURES,- Stunning 3D graphics,- Smooth and realistic driving,- 4 detailed environments: Seaport, Desert, City, Beach,- 4 game modes: One Way, Two Way, Time Attack, Free Ride,- 6 different cars (new cars on the way!),- Upgrade able Speed, Acceleration, Handling, Braking options,- Rich traffic: Trucks, Buses, Vans, Pickups, SUVs & etc. ,Please rate us and give your feedback for further improvement of the game.",,,"  1,000 - 5,000  ",8-Mar-16, 1.0s  , 21M  ,,58,4.3,Fast Traffic Racing 2016
      2.3 and up    ,Casino,"Prepare to win it big with Double 75x Slots!,Double 75x Slot Machine brings an authentic Las Vegas feel right in the palm of your hand! It has that classic penny slot vibe with 3 reels and one payline. It gives you that great casino feeling!,Start spinning with 300 free credits and compete against anyone in the world on the leaderboards today! ,Double 75x Slot Machine Features:,★ Jackpots up to 60,000,★ Global Leaderboard,★ ""Match 3"" mini game,★ Gifts every 3 hours,★ Beautiful HD Graphics,★ Amazing Sounds,Come play the newest slot machine today!",,,"  10,000 - 50,000  ",18-Feb-16, 1.0.2  , 16M  ,,113,4.1,Double 75x Slot Machine
      4.0.3 and up    ,Creativity,"Budge Studios™ Presents Strawberry Shortcake Berryfest Party- the ultimate party app! Strawberry Shortcake and her friends have some super fun party games planned and need YOUR help to make sure everyone is having the time of their lives. Help their wishes come true to add amazing decorations and activities for EVEN MORE FUN!,FEATURES,• Explore Strawberry’s world and play super fun activities,• Complete wishes to earn fruitastic rewards,• Make scrumptious cakes and smoothies at Orange Blossom’s Food Booth,• Put together a fabulous outfit at Raspberry Torte’s Fashion Boutique,• Get a glamorous new hairstyle at Lemon Meringue’s Hair Salon,• Create your berry own music at Cherry Jam’s Music Stage,• Arrange a bouquet of flowers at Strawberry Shortcake’s Flower Patch,• Inflate a bunch of balloons at Blueberry Muffin’s Balloon Booth,• ASL functionality available for the hearing impaired,Visit us: www.budgestudios.com ,Like us: facebook.com/budgestudios ,Follow us: @budgestudios ,Watch our app trailers: youtube.com/budgestudios ,HAVE QUESTIONS? ,We always welcome your questions, suggestions and comments. Contact us 24/7 at ,support@budgestudios.ca, ,COPPA COMPLIANT,Budge Studios takes children's privacy seriously and ensures that its apps are compliant with privacy laws, including the Child Online Privacy Protection Act (COPPA), a privacy legislation in the United States of America.   If you would like to learn more on what information we collect and how we use it, please visit our privacy policy at: ,http://budgestudios.ca/?p=privacy, . If  you have any questions, email our Privacy Officer at : ,privacy@budgestudios.ca,Before you download this game, please note that this app is free to play, but additional content may be available via in-app purchases. It also may contain advertising from Budge Studios Inc.  regarding other apps we publish and from partners, and social media links that are only accessible behind a parental gate. ,BUDGE STUDIOS is a trademark of Budge Studios Inc.",,,  100 - 500  ,9-Mar-16,1.3, 188M  ,Top Developer,83,3.9,Strawberry Shortcake Berryfest
      2.3 and up    ,Arcade,"This hero is very funky. But he loves pumpkins. Collect pumpkins fleeing from zombies.Share with your friends how many you collect pumpkin.,Swipe the Cowardly Hero with you finger to avoid getting hit by zombies that are all over the place, get the rotating pumpkins and get the High Score. The zombies are revolting,You have to calculate all the possiblities. You escape from the zombies. Eat Pumpkins. Complete the tasks in the list of individual success. Let's Go.,FEATURES:,• Collect Pumpkins to gain points,• Test your reaction time and reflexes,• Smooth and sleek angular motion,• Simple, intuitive functionality,• Addictive and fast paced",,,"  500 - 1,000  ",2-Mar-16,1.04, 7.8M  ,,3,5,Zombie Swipe - Cowardly Hero
      2.3 and up    ,Puzzle,Escape Games Day-236 is a point and click escape game developed by JoyArrows.It has contains scenes of Forest and Forest Home.In that game have to Escape Forest Bunny from Locked Home.In this Game contains some hidden objects and simple puzzles.You have to find the objects where it is hidden and have to solve the puzzles to Escape Forest Bunny from Locked Home.Are you to ready to play the game.Use your smart skills.All the best.Have more fun.,,,"  1,000 - 5,000  ",8-Mar-16, v1.0.0  , 2.1M  ,,54,4.6,Escape Games Day-236
      4.0 and up    ,Casual,"pj running masks is a premium yet free awesome interactive running game for kids. Enjoy playing the game and improve your problem solving skills.This cat boy run game app recommended for kids, toddlers, girls, boys, men, women and all persons in your family.This pj running masks game improves stimulate memory, cognitive skills, logical thinking, and so on. In other words, they make you and your kids smarter! this is a simple and funny running game, ideal for your children because it will train their brain, imagination and creativity while having fun.*** If you share this Game with your family and friend, I believe you will give them a surprise.***Download steven cake destroy, Today!",,,"  500 - 1,000  ",26-Feb-16,1, 17M  ,,1,5,pj running masks
