operatingSys,subcategory,description,what_is_new,url,NumInstall,DatePublished,softwareVersion,size,topDeveloper,reviews_num,Num_star,app_name
      4.0.3 and up    ,Action,"Always stay connected to the battlefield with the Battlelog app for Android phones and tablets. ,It contains all the features you need to stay on top of the game. Check your stats, see what’s next to unlock, view the results from your matches, challenge your friends to Missions, customize your Loadout and see how you’re doing in the Geo Leaderboards.,Battlelog even connects to Battlefield™ 4 while you’re playing the game! Now you can find the server you want to play on or join a friend directly from the Battlelog app with Remote Joining. You can also customize your Loadout in real-time while you’re playing, and on tablet you can even use BattleScreen to get a fullscreen, real-time minimap of the game you’re playing.,You can also connect with friends and the Battlefield™ community. Write updates to your feed, read all the latest news and join other passionate fans in the forums. With Battlelog you will always have the battlefield with you.,Battlelog Features:,•	SOLDIER STATS & PROGRESSION – View the progress and stats of your soldier to see how far you are from your next rank, how many kills you’ve gotten, and which weapon is your best.,•	LOADOUT – Customize your soldier’s Loadout wherever you are, and you can even update from the app in real-time while you’re playing.,•	SUGGESTIONS & TRACKING – Get suggestions for new awards and unlocks to pursue, or find that special weapon you’re after and track it so you can follow its progression.,•	BATTLE REPORTS – View detailed stats of your past games to inspect your strengths and weakness, and share the reports to your feed for extra bragging rights.,•	MULTIPLAYER & REMOTE JOIN – View and find servers directly in the app, and join your friends or favorite servers remotely when you’re playing.,•	BATTLESCREEN* - View the minimap in fullscreen and real-time on your tablet, while you’re playing. As squad leader you can even set new orders directly from the app.,•	LEADERBOARDS – Choose your location and see how you stack up against friends, your city, your country and the world across a wide range of stats.,•	MISSIONS – Challenge your friends to custom Missions to see who can get the most kills in a round or be the best tank destroyer.,•	CAMPAIGN – View your campaign progression, check your stats and see how many points you’ve collected compared to your friends.,•	FORUMS – Share your passion for Battlefield™ with the rest of the community in the forums. ,•	BATTLE FEED – Stay in touch with your friends’ Battlefield™ progression and share your stories with them.,•	COM CENTER – See when your friends are online and are playing Battlefield™ and get quick access to their profile and stats.,•	NEWS – Stay up-to-date with the latest Battlefield™ news from anywhere in the world.,•	PREMIUM – See what releases and drops are coming up for Premium members.,Supported Games:,•	Battlefield™ 4,•	Battlefield™ 3,*Tablet app only",,,"  5,000,000 - 10,000,000  ",27-Apr-15, 2.7.0  , 50M  ,Top Developer,"217,720",4,Battlelog
      4.0.3 and up    ,Role Playing,"★★★ Medal Masters ★★★,■ Pick Up and Play Real­Time Casual RPG,  ● Experience in­depth RPG action with easy controls and dynamic battles.,■ Develop and perfect your strategies through skill combos and Blitz control!,  ● Focus on hero composition for various strategies and tactics.,  ● Own your skills and master the Blitz system.,■ Fight intense battles with never ending action!,  ● Enhance training system ensures your heroes grow stronger by the minute!,  ● Watch your hero evolve as they gain new strength!,■ A fun and fantastical world!,  ● Engaging storyline with 245 different characters!,  ● Unique dungeons for collecting rare items and leveling up.,  ● Intense PvP wars!,  ● Prove your strength and become the best tactician in PvP arena!,★★★Join our Community★★★,Real Heroes follow Medal Masters on Facebook!,*Facebook: ,https://www.facebook.com/MedalMasters,*Forum: ,http://m.nexon.com/forum/22",,,"  500,000 - 1,000,000  ",9-Mar-16, 1.1.4  , 43M  ,Top Developer,"9,632",4.4,Medal Masters
      2.3.3 and up    ,Racing,"Were you made for the fast life? Get ready for Race Driver.,Drive your sleek race car around the city and feel the thrill of 200mph (it’s not illegal this time in this 3D town). BLAZE through city streets at intense speed! There are absolutely NO RULES! Enjoy the ADRENALINE of racing with complete ease of mind! Nothing can slow you down now--unless you crash that is! Get out of your car and explore your surroundings. You can find your own cars or purchase them! Dash through the city or go offroad. Do stunts over rooftops or drift on the streets. A realistic driving simulator with smooth controls and 4x4 physics packs quite a ride. There are NO restrictions! ,Racing Driver 2016 Features:,•Amazing Selection Of High Quality Cars Including Race Cars, 4x4 Offroad Jeep and Stunt Cars.,•Realistic And Unique Physics Configuration For Each Car.,•Simple and intuitive controls,•Amazing 3D graphics,•A realistic and precise driving experience based on real car physics.,•Cool Visual And Sound Effects,•Responsive and Realistic Gameplay,About Tapinator:,Tapinator (Ticker: TAPM) designs, develops, and publishes games on mobile platforms. The Company’s portfolio includes over 200 mobile gaming titles that, collectively, have achieved over 190 million downloads. Tapinator is headquartered in New York. For more info, visit Tapinator.com",,,"  10,000 - 50,000  ",8-Mar-16,1.1, 51M  ,,199,3.9,Racing Driver 2016
      4.0.3 and up    ,Casual,"Baby Kim needs YOU! Can you help care for this adorable, loving baby? ,Help Baby Kim grow! Dress up, feed her, give her a bubble bath and so much more! Decorate Kim’s house! Earn decorations to design Baby Kim’s house just as you like! ,Baby Kim needs your help to grow up into a beautiful little girl! Dress up Baby Kim in the most adorable clothing and accessories. Play in the park, visit the doctor, and enjoy sweet treats in the kitchen! Guess what? You can even care for Kim’s friends - Lea, Amy and Eve. It’s up to you to make Baby Kim and friends the happiest little girls ever! ,Features:,> Dress up your baby up in the cutest outfits and most stylish accessories!,> Decorate Baby Kim’s house! Earn prizes and upgrade her house! ,> Bathe your baby with sweet-smelling soaps! Get her shiny and clean!,> Care for your baby when she’s sick. Take her to the doctor’s clinic! ,> Sing and chat with Baby Kim and friends - they’ll repeat what you say!,> Play Pop the Bubbles and jump rope in the park! ,> Feed your baby with tons of sweet snacks like lollipops and ice cream!,> Say cheese! Take a picture with your favorite babies in the photo booth!,ABOUT Coco Play,Coco Play Limited is China-based developer of creative and unique apps for kids. Founded in 2013, Coco Play provides rich 3D simulation-based games for the whole family. Coco Play is a subsidiary of TabTale, a leading, global creator of innovative games, interactive books and educational apps.,Visit us: ,http://www.tabtale.com/, ,Like us: ,http://www.facebook.com/TabTale,Follow us:@TabTale,Watch us: ,http://www.youtube.com/Tabtale,CONTACT US ,Let us know what you think! Questions? Suggestions? Technical Support? Contact us 24/7 at WeCare@TabTale.com.,IMPORTANT MESSAGE FOR PARENTS: ,* This App is free to play but certain in-game items may require payment. You may restrict in-app purchases by disabling them on your device.,* By downloading this App you agree to TabTale’s Privacy Policy and Terms of Use at ,http://tabtale.com/privacy-policy/, and at ,http://tabtale.com/terms-of-use/,.,Please consider that this App may include third parties services for limited legally permissible purposes.",,,"  100,000 - 500,000  ",8-Mar-16, 1.0.3  , 55M  ,Top Developer,"2,149",3.6,Baby Kim - Care & Dress Up
      2.3.3 and up    ,Action,"Follow color pattern to cross multi colored obstacle in this paced action game! Colour Switch is a challenging action game that is fun for all ages.,The objective of Color Switch is quite simple; you need to get the ball from one end of the action to the other. However, it can’t be that easy, and it isn’t. In between the start and end points, there are many different types of obstacles that the ball needs to pass through. These obstacles are colour coded, which means that the ball can only pass through the part of the obstacle where the color of the ball matches the Color of the obstacle. If the ball tries to pass through at any other Color point it will explode, and you’ll have to start over again. You need to successfully pass the finish line in order to finish the level.,The game has two gameplay modes: one is Challenge and the other is Race. In challenge mode, there are hundreds of levels to beat. The objective is the same, get through the obstacles and cross the finish line. In the race mode, you need to do the same thing, but in the fastest time possible so that you beat the other balls.,You can also collect stars on each level. These stars can be used to purchase new shapes for your ball, such as a star, a square or even a smiley face. Collect as many shapes as you can and show them off. You can also show off your high scores in the leaderboards and compete with your friends and family, as well as collect as many achievements as you can.,Color Switch is a fun and challenging colour puzzle game. It is one of those games where you get frustrated if you get stuck, yet you will continue to play for hours until you beat the level. Then the cycle starts all over again on the next level. Resistance is futile!",,,"  10,000 - 50,000  ",11-Feb-16,1, 8.3M  ,,307,3.9,Color Switch !
      2.3 and up    ,Puzzle,"Save the bouncing bricks from hitting the hurdles and also save from dropping down.,Tap left to bounce the brick left and tap right to move it towards right. Keep it save from hurdles.,Easy? Try it.",,,"  5,000 - 10,000  ",9-Mar-16,1.1, 3.3M  ,,503,2.9,Impossible Brick Bounce
      2.3 and up    ,Racing,"Take control of 3 radio-controlled car in a huge environment with 2 racetracks, a water basin, and a mogul field !,Accomplish a lot of variety of missions to become a good driver.,!! Car Driving Simulator contains 30 levels !!,Example of missions :,- Take the bridge in the wrong way, and dodge the cars,- Don't hit the pedestrians and drive safely with your speed car,- Do all the stunts with your monster truck,- Transport the cargo to the parking pad,- Finish the racetrack, and be the first. (2 circuits),- Car chase: follow the car and don't let you outrun,- Finish the obstacle course without crashing with your offroad car,- Catch all the gangsters before they escape,- Follow the helicopter and the airplane,- Drive offroad with your monster truck,- Destroy all of the objects around you,- Get the birds out of the park,Totally free, without ""in-app purchase"" !,You must have (at least) a cpu of 1 GHz in order to play without lag.",,,"  10,000 - 50,000  ",8-Mar-16,1.1, 38M  ,,349,3.9,Car Driving Simulator
      4.0.3 and up    ,Puzzle,"There are colorful candy and lovely bird, it is a unprecedented elimination games, download and experience it!",,,"  5,000 - 10,000  ",12-Mar-16,8, 26M  ,,47,4,Color Candy Land
      2.3 and up    ,Casino,"Slots - DoubleWin Casino, #1 Casino slots game in the world! Exciting and Thrilling!,Download now! 100,000 FREE BONUS COINS are waiting for you to collect!,Win Big in your favorite casino slots! Gorgeous graphics, HUGE Jackpots, Free Daily Spins, Fun Bonus Games and Mystery Features bring casino slots from Las Vegas on your mobile. Over 5,000 Billion coins are given out each day! Will you be next billionaire in DoubleWin Casino? ,TOP FEATURES:,*  Amazing slots machines with Jackpot, Wilds, Free Spins and Bonus Games! Designed by casino professionals!,*  New FREE casino slots added every week,*  Mystery Jackpot, Mega Progressive!,*  Win up to 1,000,000 coins just for logging in daily!,*  FREE COINS bonus every 2 hours!,*  Sticky Wilds, Re-spins, Stacked Symbols, Multiple Jackpots and more!  ,Do you like playing free casino slot games? Love to win big in slots? Download Slots – DoubleWin Casino and you will enjoy the best casino slots. ,Questions or Suggestions? Contact us at ,slotsdoublewincasino@gmail.com,This casino app is intended for use by those 21 or older for amusement purposes only. Practice or success at social casino gaming does not imply future success at real money gambling.",,,"  10,000 - 50,000  ",22-Feb-16,1.01, 31M  ,,622,4.6,Slots - DoubleWin Casino
      4.1 and up    ,Casual,"In Diner Dynasty you begin in your own kitchen, making and selling breakfasts, pizzas, and ice cream sundaes. Tap to sell meals and earn money. Keep tapping to sell more. When you’ve made enough money, you can buy your very own diner! Keep playing and keep tapping to build out your Diner Dynasty with food trucks, 5 star restaurants and more!,Diner Dynasty is endless hours of delicious fun!,Diner Dynasty features:,• Easy and accessible pick up and play gameplay,• Boosts, shares and upgrades bring in more profits for your diner,• A spinning Profit Wheel to multiply your income,• New diner locations to purchase and expand your empire,• Increasing profits even while offline!,We love to hear from our players! On Twitter? Drop us a line @PikPokGames and join the conversation with #DinerDynasty,Diner Dynasty is free to play but offers in-app purchases.",,,"  100,000 - 500,000  ",7-Mar-16, 1.0.1  , 38M  ,Top Developer,"3,230",3.3,Diner Dynasty
      4.1 and up    ,Strategy,"◆Already downloaded more than 2 million times worldwide!◆,The sequel to the worldwide hit ""METAL SLUG DEFENSE"" finally appears!,""METAL SLUG ATTACK"" joins the battle with numerous improvements!,What's New in Version 1.1.0,1) Addition of 5 new Units,2) Multiple feature updates,ABOUT THE GAME FEATURES ,▼Simplified control!,""METAL SLUG ATTACK"", the very latest entry in the legendary game series from SNK PLAYMORE, is a tower defense game with simple controls which can be enjoyed by everyone, and 2D dot-pixel characters who move and battle each other smoothly! Moreover, the newly added ""Support System"" feature will offer players deeper strategies and even more fun!,▼A plethora of missions!,""METAL SLUG ATTACK"" has different types of missions for all types of players with its ""ATTACK!"" game mode, in which players have to free military bases occupied by Morden's Armies, as well as the ""P.O.W. RESCUE"", ""COMBAT SCHOOL"" or ""TREASURE HUNT"" game modes.,▼Improve your Units!,Collect items throughout your missions, and use them to customize your favorite Units. Make them evolve, level them up or activate their skills by equipping your Units with items!! Let's try to make the most impressive and poweful units!,▼Worldwide battles!,In addition to the ""Real Time Battle"" mode which can be played and enjoyed by 4 players simultaneously, up to 6 decks can clash together in asynchronous battles! Defeat all your challengers, and hone your skills to become the Best Player in the World!,▼Play in co-op with brother-in-arms!,Battle in co-op missions with brother-in-arms in the ""Guild Raid"" and ""SPECIAL OPS"" game modes, and communicate with them via the chat and mailing options. Make sure to fully enjoy ""METAL SLUG ATTACK"" with your best partners!,Official Facebook fan page:,https://www.facebook.com/METALSLUGWORLD,©SNK PLAYMORE CORPORATION ALL RIGHTS RESERVED.",,,"  1,000,000 - 5,000,000  ",9-Mar-16, 1.1.0  , 43M  ,Top Developer,"16,317",3.8,METAL SLUG ATTACK
      4.0.3 and up    ,Arcade,"Time for a Fishing Break!,Get on your boat and go on a fishing trip all around the world. Catch big rare fish, upgrade your gear, and build your collection!,Try it and get hooked :),Features:,Simple to play yet offers a nice challenge,Leaderboards for each fish to compete against your friends and the world,Achievements based on dubious puns,22 fishing spots in 8 gorgeous worlds,Hundreds of different fish (including sharks, wait until you see it!),Over 200 special elemental fish (light, dark, grass, electric, fire and ice!),Hours of relaxing fishing fun,Please share the game with your friends and rate it in the store!,Please get in touch with us if you experience any issue through the “Support” feature in the options menu or at the following email: ,support@roofdog.ca,You can also send us bad fish puns and we'll probably add achievements based on them :p",,,"  50,000 - 100,000  ",25-Feb-16, 1.0.0  , 66M  ,Top Developer,"1,894",4.3,Fishing Break
      2.3 and up    ,Adventure,"With the instinct of dinosaurs, attack and hunt without halt!,Find and hunt prey for your survival, and grow faster and more strongly than other dinosaur tribes.,You can protect your tribe from the threat and attacks of other tribes, and enjoy hunting with friends from all over the world. Don’t miss out the opportunity to meet enormous kinds of dinosaurs and living things from the Jurassic period. Oh, you can meet alien beings. ,Features,· When you start the game, you can choose one tribe among Dilophosaurus, Compsognathus, Oviraptor, and Velociraptor.,· You can find an enormous kinds of dinosaurs that lived in the Mesozoic Era such as Velociraptor and T-rex, a carnivorous dinosaurs, as well as Apatosaurus and Triceratops that are herbivorous dinosaurs.,· If you succeed in hunting, other dinosaurs of your tribe around you also receive the experience points.,· You can enjoy hunting in the map that has over 13 various characteristics and geographical features. ,· You can summon the dinosaurs of your tribe through the summoning function. ,· If you die several times in the beginning of the game, you will be transformed into a huge different dinosaur for each tribe.,· Try hunting a gigantic King Kong in the King Kong Field. If you succeed in its hunting, you will receive a Tyrannosaurus pet as a reward.,· You can fight all dinosaurs regardless of tribes only in the Colosseum of map. ,· In the Black Hole region where a meteor has dropped, you can meet huge monsters that have appeared in 4Force Online game.,· In the Sky Land, you will turn into a King Kong if you eat a dead extraterrestrial life.,※ This game has removed violent descriptions and expressions in it to protect children and adolescents, and provides a chatting-off function to prevent inappropriate conversations.,※ You cannot recover the game once it is deleted,♥ Developer’s Message,I apologize for not making Dinos Online at the right time as I promised. In fact, we are a small game development company that has only a few employees and not enough money. That’s why we’re so late. But please keep supporting the games of 1Games from now on!,Please visit our Facebook(www.facebook.com/dinosgame) or Youtube(www.youtube.com/user/hanaGames) page if you want more information.",,,  10 - 50  ,11-Mar-16, 1.0.7  , 260M  ,,343,4.6,Dinos Online
      2.2 and up    ,Action,"Download for free now!,Why Wait? Die Today! GameStop and Bandai Namco present Slashy Souls – an endless runner with endless ways to die while you’re waiting for the launch of Dark Souls III. In true Dark Souls fashion, there are no instructions and no mercy. Discover different moves through playing, defeat bosses and randomized enemies, and post your high score for a chance to win prizes. No two playthroughs are the same, so you need to git gud to get far. Have fun and be sure to follow us on Twitter on @SlashySouls for updates, new challenges, and more!,Feature List,* TOTALLY FREE - NO IN-APP PURCHASES!,* High scores win prizes!,* Challenging, Endless-Runner style Gameplay,* Epic 16-Bit Graphics and Soundtrack,* Overwhelming Obstacles and Traps,* Magical Power-Ups to Smite your Adversaries,* Fierce Bosses to Eliminate,* Leaderboards Just Waiting to be Climbed,* Epic Time Management Skills Lend us your energy! Follow us! ,https://www.facebook.com/darksouls",,,"  10,000 - 50,000  ",29-Feb-16, 1.2.3  , 49M  ,Top Developer,"1,288",2.8,Slashy Souls
      2.3.3 and up    ,Word,"Look at the picture and find the word.,Each picture means something: an emotion, a verb, an adjective or a noun. It is up to you to find the answer! Tap on the picture to zoom in and try to find the answer! Some clues are simple and some are more difficult. If you like word games or puzzle game, this word game is for you!,Features:,• Available in English, French, German, Russian, Italian, Spanish or Portuguese,• Contains 400 words,A word game for the whole family!",,,"  5,000 - 10,000  ",22-Feb-16, 1.0.1  , 27M  ,,256,4.6,Words & Pics Puzzle
      2.2 and up    ,Arcade,Fading light is a platform game in which you must navigate through a maze before your light fades out. You must collect light crystals to recharge your light and reach the finish line before darkness prevails.,,,"  100,000 - 500,000  ",2-Mar-16,1.2, 6.7M  ,,"5,105",4.8,Fading Light
      2.3.3 and up    ,Adventure,"We welcome you to play season 2 of world amazing hunting game “Jungle Dinosaur Hunting” in a dense and lush green forest, surrounded by a range of mountains for a lifetime hunting journey. Now, you are in the world of dinosaurs with huge skulls, large bone crunching teeth, powerful jaws and legs. In this dino hunting game, you will come across with different dinosaurs which are both herbivores and carnivores. You will face the most deadly dinosaurs having wild teeth over claws like Allosaurus, Brachiosaurus, Diplodocus, Giganotosaurus and armored dinosaurs like Stegosaurus etc. It is an entertainment game with high quality graphics.,You will face semi-darkness in the forest due to canopy of leaves of big trees, plants and bushes. The sounds echoed all over, making the jungle feel eerie and strange but we hope that you don’t feel scare because you are a real dino hunter. You are having modern new weapons like sniper rifles, pistol, light machine guns, carbine, shotguns, AK-47 etc. Since your life is precious, so we arrange multipurpose modern weapons to ensure your safety with sniper defense instead of being hunt down by dinosaurs.,The game comprises of diverse thrilling levels and it depends upon your shooting skills so make sure to use your sniper shooting training on ground rather than shooting species of underwater world in lake in this action pack game. It is a test of your sharp shooter skills because you can kill as many dinosaurs as you can with your kill shots being a super duper. So bravo be firm, upfront and keep on hunting these ferocious dinos and don’t look back as you are a dino hunter not a deer hunter. Any lapse in fixing the wrong weapon system scope angle may be fatal for your life as these are real dinosaurs. Don’t scare with the sounds of dinosaurs and keep hunting Jurassic world dinosaurs with right shooting target. It totally depends upon your fighting passion and adventure hunting tour of jungle world. ,Challenge your friends for hunter jungle expedition far away from school and enjoy to play this Jungle Dino hunting game full of adventure. This Jungle Dinosaurs Hunting 2 got flying dragons, running dinosaurs and fierce deadliest fighting type of dinos. ,For the first time in your life you will enjoy an unforgettable kill shot experience with a best sniper shooting game of Dinos hunting and you can awestruck by the might of nature. We believe that if you are energetic, you can catch your prey ultimately within no time and success will be yours. Wish you to be a real dinosaur hunter hero.	.,Good luck!,----:Jungle Dinosaurs Hunting game features :----,** Immersive Environment with Water Lake.,** Amazing action pack game play.,** Exciting game sound effect,** Daring & most thrilling dino hunting quests.,** First Person Shooter game play.,** Extremely challenging.",,,"  10,000 - 50,000  ",19-Feb-16,1, 46M  ,,90,3.9,Jungle Dinosaurs Hunting 2 -3D
      4.0.3 and up    ,Sports,"Think you can make it rain from beyond the arch,  with the clock ticking away and the game on the line? (the win on the line)  ,Welcome to the first ever college basketball shooting app!  Choose your favorite ACC school and compete as their top marksman from behind the line in three point shooting contests. ,ACC 3 POINT CHALLENGE lets you represent your favorite team and compete in three point shooting competitions.  Take your best shot as your work your way around the perimeter.  And be sure to hit the MONEY BALLS! ,Game Features:,•	“Around the world” style three point shooting competition,•	Play one-on-one or survive and advance the ACC tournament bracket,•	Catch fire and stay hot for extra points,•	Plays as your favorite ACC basketball team",,,  100 - 500  ,10-Mar-16,1.01, 56M  ,,8,4.5,ACC 3-Point Challenge
      4.0.3 and up    ,Arcade,"CIRCLES is a free minimalist game with beautiful music and addictive gameplay.,How to play:,- tap & hold to build the wall and block the incoming dots,- building walls uses up the blue core - manage it well!,- the blue core regenerates once a wall is hit,- you get 3 green circles/lives per game,- One tap gameplay,- Block the dots,- Save the circles,- Beat high scores,- Unlock all heroes",,,"  1,000 - 5,000  ",18-Feb-16, 1.0.0  , 33M  ,Top Developer,68,4.5,Circles
