operatingSys,subcategory,description,what_is_new,url,NumInstall,DatePublished,softwareVersion,size,topDeveloper,reviews_num,Num_star,app_name
      2.3 and up    ,Sports,"Mini Golf Center is the most interesting FREE Golf game!,The tricky golf ground design will probably make you crazy at first. But don't worry! All you need to do is to keep practicing golf playing skill. Adjust shot angle carefully, master the essence of strength control. You will be a pro golfer and play every shot nicely!,Mini Golf Features:,- Grasp the skill of real golfing,- 216+ challenging and uniquely designed mini golf holes,- Stunning graphics and fantastic sound,- Experience the greatest golf course,- Over 24 scenes, play golf outside golf club: check station, restaurant, power station, outer space.etc   ,- More levels are coming! ,Play Mini Golf game anywhere, anytime. You are the next legendary golfer!",,,"  50,000 - 100,000  ",11-Mar-16, 1.6.078  , 24M  ,,541,4,Mini Golf Center
      2.3.3 and up    ,Strategy,"If you wish to become a better player, this guide might help you to be such one. It is very easy to follow, accompanied with easy to follow tricks, which you can implement with relatively speed. Enter the arena once you are armed with more info, since knowledge is power and it can boost your game level. ,Thank you very much for getting our app.",,,"  100,000 - 500,000  ",14-Feb-16,1, 2.6M  ,,"1,472",3.2,Guide for Clash Royale
      4.4 and up    ,Sports,"Choose your team, set your lineup, and challenge your friends on the court! NBA Breakaway is an exciting collectible card game that blends the strategy of roster and playbook selection with interactive, real-time, player vs. player action. Collect all of your favorite NBA players, add them to your team, and trade them in the marketplace.,Features:,- PLAYER CARDS: Collect over 650 different NBA player cards with custom artwork.,- ACTION CARDS: Build your playbooks from more than 50 action cards, and use them to gain a strategic edge over your opponents.,- MULTIPLAYER: Climb the ranks by competing against other players in a ranked match-making system, or practice your shooting and try out new strategies in a casual game.,- SEASONS & LEAGUES: Play against AI opponents in a full NBA season, or take the league challenge against every NBA team.,- DAILY CHALLENGE & ACHIEVEMENTS: Complete the daily challenges and lifetime achievements to earn extra rewards.,- MARKETPLACE: Interact with a completely player-driven Marketplace. You can buy, sell, and bid on cards to fill out your favorite team or build your playbook.",,,"  10,000 - 50,000  ",2-Mar-16, 1.1.5  , 56M  ,,455,4.1,NBA Breakaway
      3.0 and up    ,Puzzle,"Sudoku (originally called Number Place) is a logic-based, combinatorial number-placement puzzle. The objective is to fill a 9x9 grid with digits so that each column, each row, and each of the nine 3x3 sub-grids that compose the grid contains all of the digits from 1 to 9.,FEATURES:,- different difficulties,- hundreds of puzzles for each difficulty,- hint system,- auto-save your progress for each puzzle,- unlimited undo/redo,- selected cell highlight,- number highlight (optional),- errors highlight (optional),- clean interface and smooth controls",,,,11-Mar-16,3.1, 1.4M  ,,14,3.3,Sudoku
      2.3 and up    ,Role Playing,"Hoist the Jolly Roger and set sail to find the legendary Titan’s Treasure! Do you fight with a cutlass, or with magic? Are you biding your time until you can shoot your captain in the back, or are you the reason the rum is gone?,""Scarlet Sails"" is an 80,000-word interactive novel by Felicity Banks, author of ""Attack of the Clockwork Army"". Your choices control the story. It's entirely text-based--without graphics or sound effects--and fueled by the vast, unstoppable power of your imagination.,• Enjoy an 80,000 word adventure on the high seas.,• One of the top ten games in the 2015 Interactive Fiction Competition.,• Choose your personality, fighting style, and magical skill.,• Choose who to love, including options for singlehood or polyamory.,• Face the horrors of your past, and of the deep.,• Find treasure, treachery, and maybe even true love.,• Play as male or female, gay or straight.",,,  100 - 500  ,12-Mar-16, 1.0.1  , 3.8M  ,,27,4.3,Scarlet Sails
      2.2 and up    ,Adventure,It is time for some fun. You are about to control the actions of the featured stickman character in the game who is in the prison. His ultimate goal is to escape the prison.,,,"  10,000 - 50,000  ",2-Mar-16,1, 8.0M  ,,491,4,Stick Escape - Adventure Game
      2.3 and up    ,Action,"Realistic Gangster story.,Criminal gangs seized South San Andreas in the early 90s. Crime rate in the city reached the highest level.,It was not easy for city newcomer Ken. Help him to maintain order again.,- More than 10 weapons,- Realistic gang wars,- More than 30 cars,- Drive all cars in the city freely,- Realistic city car driving,- Realistic traffic system,- Big city maps (San Andreas like enormous city),- Various camera angles (Inner cam, Front cam, outer cam and more),- Amazing 3D graphics,- More than 15 language support,Completely realistic Gangster Game. Download City Gangster game right now for free.,You can reach us for any questions or problems on ,help@zuuks.com,.,_________________________________________________________________,Our website: ,http://www.zuuks.com,Follow us on Facebook: ,https://www.facebook.com/zuuks.games,Follow us on Twitter: ,https://twitter.com/ZuuksGames",,,"  50,000 - 100,000  ",1-Mar-16,,,,"2,124",4.3,City Gangster
      4.1 and up    ,Arcade,"How to play:,1. Pop handbrake,2. Park car,3. Don't crash!",,,  50 - 100  ,6-Mar-16,1, 24M  ,,145,4.5,Handbrake Valet
      2.3 and up    ,Sports,"Everyone know the classic game of Mini Golf, even if you know it by a different name, such as crazy golf or silly putt, if you’re anything like the Bit of Game team, then I’m pretty sure it brings back a lot of very happy childhood memories, taking you back to a time where your mind is on nothing other than the magical little world you’re in and the only thing you have to focus on is getting that little ball into the hole at the end of the course.,When designing this little sports game, our aim was to put as much of that childhood magic into it as possible, we might not be able to get back to that time, but we’re certainly going to at least try adding some of that magic into the games we make, not only so our users can make new memories on these stunning 3D courses, but so we also have fun producing and testing it. After all, that’s what matters, if the gamers are happy and we’re enjoying it, that’s the sort of thing that makes life what it is.,So the actual game, you have a huge number of levels to play through, with a set number of shots to do it and dozens of obstacles in your way, everything from loops to spinning wheels, springboards and ramps. Do you have the sports skills to take on each one and beat the game? Well, lets see how good you really are. We also thought, why play with the same old boring golf ball, so we added many skins for you to have on the ball, giving you a variety of thing from a spotty ball to a juggling ball.,Let's take your putting skills to the next level, go get golfing!",,,"  5,000 - 10,000  ",2-Mar-16,1, 40M  ,,58,3.5,Mini Golf Putter
      2.3 and up    ,Puzzle,"Match and stitch irresistible fancy dresses, suits and bags, and make colorful new outfits for the friendly clients of Fancy Tale: Catherine the Cat, Pip the Penguin and many more! ,Get into the world of fame and haute couture and make them shine on the red carpet. Collect, match and create new designs in the most addictive fashion puzzle game. It’s free to play!,Travel through different fashion shops from downtown boutiques to the Wild West countryside. Mix and sew from the newest creations or give a retro style a revival. Share your results with your friends and brag about your style! ,Do you fancy being the latest top fashionista? Enter a world of fame and compete in this shiny, addictive puzzle game with hundreds of levels. ,The wonderful fashion world of fancy tale is waiting for you… Your fashion boutique puzzle game!,From the creators of your favorite puzzle cooking game: Tasty Tale! , What’s to like?,- Easy to learn, hard to master,- Fancy shops from all over the world,- Friendly animals as your loyal customers ,- Addictive gameplay in the fanciest match 3 game,- Over 100 levels with fun and challenging obstacles ,- Seamless synchronization with Facebook,- Leaderboard to compete against friends ,Follow us on Facebook page to get the latest updates: ,https://www.facebook.com/fancytale,Already a fan of Fancy Tale? Like us on Facebook for the latest news: ,https://www.facebook.com/fancytale,So what are you waiting for? Plenty of fashionable creations are ready for you in the most addictive game on Facebook. Play now!, ,Please note that, while Fancy Tale is completely free to play, some in-game items such as extra moves or lives will require payment.",,,"  10,000 - 50,000  ",10-Mar-16,9.1, 55M  ,,906,4.7,Fancy Tale:Fashion Puzzle Game
      2.3 and up    ,Simulation,"The real prison escape story begins with you playing as the police dog to catch jail escaping prisoner. Be the k-9 police dog to save city from criminals. Chase criminals, catch prisoners and control the security of the prison with the police force. Safety of the city is your first priority so start your duty.,A  thrilling and exciting Police Dog escape mission simulator. Use your energies and try to successfully chase & arrest prisoners. Surprise dangerous criminals and never let your town turn into a crime city! Enjoy Prisoner Escape Police Dog game in city jail break crimes environment and help cops to save the city.,You have been chosen as an expert police dog to stop and hunt the robber involved in the prison break crime. Use your sniffing skills to chasing down and lockup dangerous criminals with Police Dog. Assist the police officer as a skilled K-9 cops dog to end up the criminal activities.,Clever hunting and sniffing skills to being the best Police dog in city! Actually this Police dog simulator game for those who always want to play like a clever dog. Help police to chase and catch hard time criminals.,•	An Interesting prisoner escape Simulation game,•	Real time Police dog simulator Game Play,•	K-9 Dog Sniffing and catching criminals Action Pack Game,•	City Subway Station & town streets to explore,•	Realistic jail, Subway train Station & city environment,•	Easy and fun entertainment to play as Police Dog,•	10 extreme action simulation packed challenging missions",,,"  5,000 - 10,000  ",10-Mar-16,1.1, 49M  ,,107,3.9,Prisoner Escape - Police Dog
      4.0.3 and up    ,Casino,"A New Free Game !!!,The most exciting and thrilling Slot on mobile and tablet.,Better graphics, smooth animation and the most HUGE prizes!,No internet or wifi needed!,Bonus rounds and Free Spins, real sounds and unlimited passion!,No one can resist the magic of this slot. You will be charmed and so the gain for you GUARANTEED!,We love our slot - Games. They are delicious and beautiful.,DOWNLOAD NOW IF YOU LIKE SLOTS! YOU WILL LOVE SLOTS - Mysterious ★ FREE !!!,In a normal game you just press a «Spin», but here you'll get an incredible adventure in the magical world of secrets. Everything is shrouded in mystery and only the most courageous and resourceful waiting for the Great Victory! Go to the best trip of your life. Start Now and untold wealth will be yours! FORWARD!,Would you like to enjoy more of our entertaining games on the move? ,Then download our VIP Slots Club ★ FREE Casino app!,Good luck!,❤ Like us on Facebook: ,https://www.facebook.com/SlotsClubVIP, ❤,❤ Any suggestions/recommendations you can send to ,want2say@duksel.com, ❤",,,"  5,000 - 10,000  ",29-Feb-16, 1.6.5  , 14M  ,,75,4.4,Mysterious Slot ★ FREE
      4.0.3 and up    ,Casual,"One off one off another off, click, slide, shoot, rebound, Curtain hangs together following the baby panda climbing up, you will experience a variety of fun and interesting things, of course, there will be a danger in the side, but do not worry, there will be a lot of enthusiastic small animals to help you. All kinds of surprises waiting for you, come together.",,,"  1,000 - 5,000  ",27-Jan-16,1, 22M  ,,42,4.5,Plants Bubble Mania
      2.3 and up    ,Simulation," Are you the parking expert that we’re looking for? , , Army Extreme Parking Simulator , is a parking game set in the WW2 era. So this means that you will park different kinds of army wars trucks, including some WW2 style trucks. You are on normandy beach also called Omaha Beach, it will not be easy to park your army truck here because of all the trenches! Be on guard and be swift! , The extreme army parking wars are starting right now! ,No, not the WW2 war is starting, the parking wars are starting. This means that you have little time, a lot of pressure and only your truck to complete every level of , Army Extreme Parking Simulator , . Think you can manage this? It is imperative that you accomplish your job as a army truck driver, your comrades are nothing without the supplies that you deliver. The parking needs to be spot on because it is WW2 after all. , Drive four different army trucks in Army Extreme Parking Simulator!  ,With every mission that you complete comes a new truck. The four different trucks will be more difficult to manage because of the power, size and handling of the army truck. Next to a APC, you can drive a German Truck, Hummer and of course, a real army tank! But don’t think that you can drive over everything just because you have an army truck, you’ll have to drive and park correctly to complete every missions! , Army Extreme Parking Simulator - Game Features: ,- Army Parking in a WW2 setting! ,- Park your army truck on Omaha Beach! ,- Drive four different vehicles in Army Extreme Parking Simulator!,- 20 Missions for you to enjoy! ,  ,*** ANY IN GAME PURCHASE WILL REMOVE ADS FOREVER ***,We’re on Twitter, Facebook and more - find us on your favourite networks to hear about our newest games and other news updates:,Facebook - ,https://www.facebook.com/MobileGamesbv,Twitter - ,https://twitter.com/mobilegamesbv,YouTube - ,https://goo.gl/snGH7I",,,"  10,000 - 50,000  ",3-Mar-16,1, 49M  ,,215,3.8,Army Extreme Parking Simulator
      2.3 and up    ,Casual,"Mermaid mommy has a newborn baby girl. Would you like to take care of this cutest baby mermaid and accompany her grow up?,She’s going to have her first birthday. The whole mermaid family planned a grand party for her. Please give the baby mermaid a bath and wear fancy dress for her. ,Our mermaid girl is preparing to go to school! Help her dress in school uniform, comb her hair and take school bag with her. Oh, bad new! Please take her to see doctor since she ate too much sweets causing tooth decay.,The mermaid girl is in her high school now. She joins baseball club, learns make up and becomes a beautiful girl! ,Our mermaid girl gets her fist job in a bakery shop! Please help her make delicious cakes!,The amazing day comes. She meets her prince charming when the first time she surfaces to see sunrise. They fall in love with each other. Please help the mermaid make magic potion which could give her human legs after drink it.,The wedding day comes! Wearing fabulous wedding dress and jewelry, she married with her prince charming and turn into a real princess! ,There are 7 stages in this game:,The mermaid girl is going to be born,The mermaid girl’s first birthday;,The mermaid girl’s first day of school life ,The mermaid girl’s high school life ,The mermaid girl’s first job ,The mermaid girl becoming a real princess ,The mermaid girl’s wedding  ,This is a girls' game & casual game & fasion game & kids game! ,Find more free online games, please browse the website www.6677g.com. No need to download!",,,,10-Mar-16, 1.0.0  , 42M  ,,85,4.3,Mermaid Grows Up
      2.3 and up    ,Casual,"Enjoy hunting for hidden items among beautiful nature-inspired scenery featuring treehouses of all types.,Choose how you want to hunt for items in FREE PLAY mode, or play through a map-based CAMPAIGN.,In FREE PLAY mode there are 4 ways to find the items: Picture, Silhouette, Word or Random. Select the relaxing Casual mode, or more challenging modes with time limits and bonus rounds. Practice mode is also included.,Play the CAMPAIGN over 100 beautiful levels that gradually increase in difficulty. Things start off easy as you hunt for items by Picture. Time limits and exciting bonus rounds are added, and pretty soon you will be searching for items by Silhouette and Word, or trying to find rotated Picture items. Challenge yourself to earn 3 star ratings on each level! Hints are available if you get stuck!,Play the super fun Match3 and Memory mini games, try the Daily Lottery and much more!",,,"  10,000 - 50,000  ",22-Feb-16, 1.0.3  , 38M  ,Top Developer,204,4.6,Hidden Object - Treehouse Free
      2.3 and up    ,Simulation,"Welcome to Construction Truck 3D: Gravel!,Gravel is an important material in the construction world, it is used for roads for example. As a Construction Truck Driver it is your responsibility to deliver the gravel on time. Delivering gravel is not easy, you have to maneuver your big truck and trailer into tiny loading places. In this Gravel edition of Construction Truck 3D you'll learn how to drive properly with a Construction Truck filled with Gravel. In 15 exciting levels you'll face all sort of driving tests, from reverse driving to forward driving in a tiny spot. To finish a level you first have to attach the trailer, to do that follow the red arrows. After you've attached the trailer you have to load your trailer, to do that follow the blue arrows. After the trailer is loaded you have to park your truck and trailer, to do that follow the yellow arrows.,Construction Truck 3D: Gravel features,- Easy truck controls,- Cab-view with side mirrors,- Google Play Games,- Construction environment,- 15 levels,When you enjoyed Construction Truck 3D: Gravel please support us by following us on Twitter: ,https://twitter.com/JansenGames,Facebook: ,https://www.facebook.com/JansenGames",,,"  10,000 - 50,000  ",5-Mar-16,1, 42M  ,,218,4,Construction Truck 3D: Gravel
      2.3 and up    ,Casual,"The Misty Shore holds mysterious secrets to be uncovered! Do you dare go there?! Hunt for artfully hidden items among the spooky scenes.,FREE PLAY,Choose exactly how you want to search for items. Find items by their Picture, Silhouette, Word, or Random combination. Play Casual rounds with no time pressure, or more challenging timed modes.,CAMPAIGN MODE,Challenge yourself to complete the map of 100 beautiful levels with increasing difficulty. Hunt for hidden objects in a variety of ways, play timed levels and fun bonus rounds.,HD IMAGES WITH ZOOM,Zoom and pan the beautiful HD images. Tap on the search objects to enlarge them.,COINS AND DAILY REWARD,Use coins earned while completing levels to unlock more content. Try your luck in the Daily Reward for bonus coins!,MINI GAMES,Have fun and earn extra coins by playing the Match 3 and Memory Mini Games.,AND MUCH MORE,Hints available for when you get stuck, 3-star ratings and highscores, change your avatar, and a purchase option to hide all ads and buy coins. Plus lots more!",,,"  5,000 - 10,000  ",26-Feb-16, 1.0.4  , 41M  ,Top Developer,110,4.3,Hidden Object - Misty Shore
      2.3 and up    ,Arcade,"Are you ready to RAGE? ,Make your way through each Rage Arcade game by beating high scores and collecting items to unlock the next challenge. These games may seem easy and simple, but don't be fooled.,Try to stay calm and cool as you play....can you do that?",,,  10 - 50  ,11-Feb-16,1, 24M  ,,57,4.3,Rage Arcade - Addicting Games
      4.0 and up    ,Simulation,"PUBLIC TRANSPORTATION GAMES HAVE NEVER BEEN THIS MUCH FUN,Get ready to experience the ultimate simulation feeling. Be the city bus driver in this bus simulator game. Mobile simulation games have never been this realistic. Are you a skilled enough passenger driver that can complete all adrenaline filled missions? If not, don’t worry. Just enter the free ride mode and practice your bus driving skills. Once you think you’re ready simply switch to career mode and let the  fun game challenges begin!, ,YOUR PROFESSIONAL BUS DRIVING CAREER STARTS NOW,Drive around in one of te best looking locations and enjoy stunning simulation graphics and physics. Get ready for some city bus driving, mountain hill driving, drive at night and unlock and collect all the beautiful commercial busses. The details are really incredible! Get on board and enjoy the ride!  , ,KEY FEATURES  of this Commercial Bus Simulator 16 game, ,✔ Cutting edge city bus driver graphics bus simulator game,✔ Amazing city driving locations and amazing public transportation simulator features,✔ Beautiful and detailed bus exteriors and interiors   ,✔ Ground breaking commercial bus simulation games physics,✔ Adrenaline-filled public transportation simulator excitement,✔ Commercial bus simulation day and night driving,✔ Detailed and complex city bus driver missions in this bus simulator game,✔ Realistic commercial bus simulation mountain environment,✔ More city driving and public transportation simulator fun will follow, , ,*** ANY IN GAME PURCHASE WILL REMOVE ADS FOREVER ***, ,We’re on Twitter, Facebook and more - find us on your favorite networks to hear about our newest games and other news updates:, ,▶ Website | www.trimcogames.com,▶ Facebook | www.facebook.com/TrimcoGame,▶ Twitter | www.twitter.com/gamestrimco,▶ YouTube | www.youtube.com/trimcogames",,,"  10,000 - 50,000  ",26-Feb-16,1.2, 65M  ,,322,3.7,Commercial Bus Simulator 16
      4.0 and up    ,Casual,"Welcome to the amazing sweet land in one of the best matching games in the world! ,Little candy paradise in little match game with cupcake and donut galaxy, immaculate lollipop space, mountains of jellies, other and other sweet things! This sweetygame will make you happy!,- 100+ levels waiting for you in Jelly Monsters - Sweet Trip,- Beautiful crush, blast and splash of jelly monsters,- Nice HD graphics for tablet and smartphone,- Pop this jelly monsters for your pleasure,- Deluxe sweet jellies land, candies space and lollipops adventure!,- Amazing sweet journey with story line in this match 3 quest game,Enjoy each and every sweet world with entertaining challenges.,HOW TO PLAY:,1. When you match three or more Jelly Monsters of the same color together, they are cleared from the play field.,2. Match five or more sweet monsters to have a combo!,3. Create combos, sweet bombs and jelly blasts to get more scores and share it to your friends!,Blast and splash nice jelly monsters, crush candy or cookie, pop magic bubble and sweet bomb! You can lay one of the best 3 match games without internet connection! Start of sweet journey is easy, but things get more and more interesting and challenging. ,Bring this top casual game with candy island, jumping jellies, nice sweet monsters and share your progress with your friends on your page in facebook. Nice Jelly jump and pop on your device!,3 matching puzzle with jellies, lots of levels, fun time together with splashing jelly animation. Free Match 3 games with bonuses is here! You can find it on Jelly Monster - Sweet Mania!,Our team is glad to see your comments.,Leave it here ,or write to ,sweetgamesbox@gmail.com",,,"  10,000 - 50,000  ",10-Mar-16,1.2, 42M  ,,"3,778",4.8,Jelly Monsters - Sweet Mania
      4.0.3 and up    ,Adventure,"Think you can survive in a war between the gods? Challenge your courage, strength, and stamina in Gods of Egypt: Secrets of the Lost Kingdom. ,Put your fighting skills to the test in this all-new action game, based on the upcoming film Gods Of Egypt. Play as Horus, god of the sky, and his human sidekick Bek. Together you'll battle against evil god Set and his otherworldly creatures. ,The Battle For Eternity Begins. Gods of Egypt – In Theaters February 26. Starring Gerard Butler, Brenton Thwaites, Nikolaj Coster-Waldau, Courtney Eaton, Elodie Yung and Chadwick Boseman.,#GodsOfEgypt,http://GodsofEgypt.Movie,http://Facebook.com/GodsOfEgyptMovie,http://Twitter.com/GodsOfEGypt,http://Instagram.com/GodsOfEgypt,In this spectacular action-adventure, the survival of mankind hangs in the balance as an unexpected mortal hero Bek [Brenton Thwaites] undertakes a thrilling journey to save the world and rescue his true love. In order to succeed, he must enlist the help of the powerful god Horus [Nikolaj Coster-Waldau] in an unlikely alliance against Set [Gerard Butler], the merciless god of darkness, who has usurped Egypt’s throne, plunging the once peaceful and prosperous empire into chaos and conflict. As their breathtaking battle against Set and his henchmen takes them into the afterlife and across the heavens, both god and mortal must pass tests of courage and sacrifice if they hope to prevail in the epic final confrontation.",,,"  50,000 - 100,000  ",3-Mar-16,1.2, 173M  ,,"2,272",4.2,Gods Of Egypt Game
      2.3 and up    ,Casual,"Delve in a beautiful land filled with stunning scenes painted with the colors of rainbow! Pick your favorite color and experience fun in this exciting colorful world!,""Rainbow"" features HD graphics, beautiful artwork and music! Solve 20 beautiful, handcrafted boards as difficulty increases. Can you become the mahjong expert?,Main features:,- New mahjong mechanic and unique power system,- 20 handcrafted backgrounds,- Beat your best times,- Daily rewards,- Replay for high scores,- Earn coins and unlock more boards,- Become the mahjong master!,Powered by Dolby® on supported devices",,,"  1,000 - 5,000  ",6-Mar-16, 1.0.6  , 29M  ,,71,4.7,Hidden Mahjong: Rainbow
